{
  "bomFormat": "CycloneDX",
  "specVersion": "1.7",
  "serialNumber": "urn:uuid:20204fdb-c6ff-499c-bad4-bf37aaf93807",
  "metadata": {
    "timestamp": "2026-10-06T07:11:57Z",
    "tools": [
      {
        "name": "cataloga-example-generator",
        "version": "0.9.0"
      }
    ],
    "component": {
      "type": "application",
      "bom-ref": "system-vran-edge-1",
      "name": "vRAN Edge Cluster A"
    }
  },
  "systemContext": {
    "systemClass": "telecom",
    "criticality": "high",
    "boundary": "enterprise-edge",
    "migrationWindow": "2028-2030"
  },
  "components": [
    {
      "type": "cryptographic-asset",
      "bom-ref": "alg-rsa2048-0001",
      "name": "RSA-2048",
      "cryptoProperties": {
        "assetType": "algorithm",
        "algorithmProperties": {
          "algorithmFamily": "RSA",
          "algorithm": "RSA",
          "parameterSetIdentifier": "2048",
          "securityLevel": 2048
        },
        "usage": "TLS-1.2-key-establishment"
      },
      "locationProvenance": {
        "method": "example-corpus",
        "confidence": 1.0,
        "timestamp": "2026-10-06T00:00:00Z"
      },
      "lifecycleState": "active",
      "canonicalKey": "sha256:41ccd5d247d9b8d74455749b481b1c9e2b9762dd592a03b305264585f3353e37",
      "qvClassification": "classical-112",
      "_provenance_sources": [
        {
          "method": "example-corpus",
          "confidence": 1.0,
          "timestamp": "2026-10-06T00:00:00Z"
        }
      ],
      "_duplicate_count": 1
    },
    {
      "type": "cryptographic-asset",
      "bom-ref": "cert-edge1-0002",
      "name": "TLS Server Cert (edge-1)",
      "cryptoProperties": {
        "assetType": "certificate",
        "algorithmProperties": {
          "algorithmFamily": "RSA",
          "algorithm": "RSA",
          "parameterSetIdentifier": "2048"
        },
        "usage": "tls",
        "certificateProperties": {
          "issuer": "CN=Edge CA",
          "subject": "CN=edge-1",
          "notValidAfter": "2027-03-01",
          "renewal": {
            "mechanism": "ACME",
            "renewBeforeDays": 30
          }
        }
      },
      "locationProvenance": {
        "method": "example-corpus",
        "confidence": 1.0,
        "timestamp": "2026-10-06T00:00:00Z"
      },
      "lifecycleState": "active",
      "relationship": {
        "parent": "system-vran-edge-1"
      },
      "canonicalKey": "sha256:d4b4bef50e1995977311521722bf114dcc3f4d7e47b7340eb44784edb7d36a95",
      "qvClassification": "classical-112",
      "_provenance_sources": [
        {
          "method": "example-corpus",
          "confidence": 1.0,
          "timestamp": "2026-10-06T00:00:00Z"
        }
      ],
      "_duplicate_count": 1
    },
    {
      "type": "cryptographic-asset",
      "bom-ref": "alg-mlkem768-0003",
      "name": "ML-KEM-768",
      "cryptoProperties": {
        "assetType": "algorithm",
        "algorithmProperties": {
          "algorithmFamily": "PQC",
          "algorithm": "ML-KEM",
          "parameterSetIdentifier": "768",
          "securityLevel": 0
        },
        "usage": "TLS-1.3-pqc-key-establishment"
      },
      "locationProvenance": {
        "method": "example-corpus",
        "confidence": 1.0,
        "timestamp": "2026-10-06T00:00:00Z"
      },
      "lifecycleState": "active",
      "canonicalKey": "sha256:9d2cf8427fed3b483309593c88a2d8d6267434ecb8d8f6c2dc371ee0ed36a1b3",
      "qvClassification": "PQC-ready",
      "_provenance_sources": [
        {
          "method": "example-corpus",
          "confidence": 1.0,
          "timestamp": "2026-10-06T00:00:00Z"
        }
      ],
      "_duplicate_count": 1
    },
    {
      "type": "cryptographic-asset",
      "bom-ref": "alg-x25519mlkem-0004",
      "name": "X25519MLKEM768",
      "cryptoProperties": {
        "assetType": "algorithm",
        "algorithmProperties": {
          "algorithmFamily": "PQC",
          "algorithm": "X25519MLKEM768",
          "parameterSetIdentifier": "768",
          "securityLevel": 0
        },
        "usage": "hybrid-key-agreement"
      },
      "locationProvenance": {
        "method": "example-corpus",
        "confidence": 1.0,
        "timestamp": "2026-10-06T00:00:00Z"
      },
      "lifecycleState": "active",
      "canonicalKey": "sha256:4db819b671580cd3a8b3ebdc3b0c8d2c74555b9e17009e6586cae5fac3bffc6d",
      "qvClassification": "hybrid",
      "_provenance_sources": [
        {
          "method": "example-corpus",
          "confidence": 1.0,
          "timestamp": "2026-10-06T00:00:00Z"
        }
      ],
      "_duplicate_count": 1
    },
    {
      "type": "cryptographic-asset",
      "bom-ref": "alg-aes256-0005",
      "name": "AES-256-GCM",
      "cryptoProperties": {
        "assetType": "algorithm",
        "algorithmProperties": {
          "algorithmFamily": "AES",
          "algorithm": "AES-256-GCM",
          "parameterSetIdentifier": "256",
          "securityLevel": 256
        },
        "usage": "record-protection"
      },
      "locationProvenance": {
        "method": "example-corpus",
        "confidence": 1.0,
        "timestamp": "2026-10-06T00:00:00Z"
      },
      "lifecycleState": "active",
      "canonicalKey": "sha256:58e4a86a4973ddd6fc051f4f71fa66914d9de4295c2166b4915921ee6bc88585",
      "qvClassification": "classical-128+",
      "_provenance_sources": [
        {
          "method": "example-corpus",
          "confidence": 1.0,
          "timestamp": "2026-10-06T00:00:00Z"
        }
      ],
      "_duplicate_count": 1
    }
  ],
  "dependencies": [
    {
      "ref": "cert-edge1-0002",
      "dependsOn": [
        "system-vran-edge-1"
      ]
    }
  ],
  "vulnerabilities": [
    {
      "bom-ref": "vuln-rsa2048-0001",
      "id": "PQC-MIGRATION-RSA2048",
      "analysis": {
        "state": "exploitable",
        "detail": "key establishment vulnerable post-2030 (NIST IR 8547: 112-bit deprecated after 2030, disallowed after 2035)",
        "remediation": {
          "recommendation": "migrate to ML-KEM-768 hybrid by 2030",
          "priority": "high",
          "window": "2028-2030"
        }
      }
    }
  ]
}